{
  "schema_version": "side.live_preflight.result.v1",
  "artifact_kind": "live_preflight_result",
  "execution_mode": "no_order_preflight",
  "result": {
    "status": "passed",
    "failure_class": null,
    "failure_reason": null,
    "terminal_gate": null
  },
  "risk_gate": {
    "schema_version": "risk_contract.v2",
    "contract_version": "v2",
    "validator_result_schema_version": "risk_contract_validator_result.v2",
    "schema_ref": "risk/contracts/v2/risk_contract_v2.schema.json",
    "validated_schema_ref": "risk/contracts/v2/risk_contract_v2.schema.json",
    "validator": "scripts/validate_risk_contract.py"
  },
  "live_preflight": {
    "order_mutation_allowed": false,
    "order_mutation_attempted": false,
    "broker_mutation_attempted": false,
    "account_proof": {
      "account_alias": "acct-alias-primary",
      "broker_alias": "broker-alias-sim",
      "account_snapshot_ref": "acct-snapshot-sha256-fixture",
      "snapshot_ts": "2026-05-19T00:00:00Z",
      "snapshot_max_age_ms": 30000,
      "base_currency": "USD",
      "equity_ref": "equity-ref-sanitized",
      "cash_available_ref": "cash-ref-sanitized",
      "buying_power_ref": "buying-power-ref-sanitized",
      "open_exposure_digest": "exposure-sha256-fixture",
      "open_orders_digest": "orders-sha256-fixture"
    },
    "market_proof": {
      "symbol": "EURUSD",
      "market_snapshot_ref": "market-snapshot-sha256-fixture",
      "market_ts": "2026-05-19T00:00:01Z",
      "market_max_age_ms": 5000,
      "price_ref": "quote-ref-sanitized",
      "spread_bps": 1.85,
      "price_source_alias": "fixture_sanitized_quote"
    },
    "order_intent": {
      "side": "buy",
      "order_type": "limit",
      "time_in_force": "IOC",
      "requested_notional": 10000.0,
      "allowed_notional": 7500.0,
      "notional_currency": "USD",
      "notional_source": "manual_preflight",
      "price_bounds_ref": "price-bounds-sha256-fixture",
      "max_slippage_bps": 5.0,
      "idempotency_key_hash": "idempotency-sha256-fixture",
      "order_mutation_allowed": false
    },
    "kill_switch_proof": {
      "global_gate_status": "passed",
      "global_gate_ref": "gate-ref-sha256-fixture-global",
      "strategy_gate_status": "passed",
      "strategy_gate_ref": "gate-ref-sha256-fixture-strategy",
      "symbol_gate_status": "passed",
      "symbol_gate_ref": "gate-ref-sha256-fixture-symbol",
      "broker_account_gate_status": "passed",
      "broker_account_gate_ref": "gate-ref-sha256-fixture-broker-account",
      "proof_ts": "2026-05-19T00:00:02Z",
      "proof_max_age_ms": 10000
    },
    "idempotency_proof": {
      "candidate_identity_digest": "candidate-identity-sha256-fixture",
      "idempotency_key_hash": "idempotency-sha256-fixture",
      "duplicate_check_status": "passed",
      "duplicate_check_ref": "duplicate-check-sha256-fixture",
      "proof_ts": "2026-05-19T00:00:03Z",
      "proof_max_age_ms": 10000
    }
  },
  "emission": {
    "persisted": true,
    "protected_output_root": false
  }
}
